run_id,timestamp,git_commit,model_name,config_hash,fold_count,fold_spacing,wrmsse,wape,bias,wape_h1_7,wape_h8_14,wape_h15_28,wrmsse_spread,wape_spread,bias_spread,wape_h1_7_spread,wape_h8_14_spread,wape_h15_28_spread,seconds,status,findings_file,author,verdict,session,hypothesis_id,dataset,wrmsse_hier,wrmsse_hier_spread,bagged
r091,2026-09-13T23:30:17+00:00,f5c0c51-dirty,recipe4_rolling,cff45d408591,8,14,0.811477,0.761932,-0.040726,0.738000,0.758247,0.776491,0.000753,0.000728,0.002936,0.000114,0.002023,0.000439,772.6,ok,findings/r091.md,human,discarded,recipe-20260913-2,H114,m5_ca1,,,False
r092,2026-09-13T23:44:04+00:00,f5c0c51-dirty,recipe5_price,07ef02dc2dfb,8,14,0.811147,0.761109,-0.041663,0.737235,0.758520,0.775138,0.002349,0.000545,0.003225,0.001941,0.001875,0.001977,822.8,ok,findings/r092.md,human,discarded,recipe-20260913-2,H115,m5_ca1,,,False
r093,2026-09-13T23:59:23+00:00,3afe493,recipe6_calendar,0d8c60f54f6e,8,14,0.812457,0.760635,-0.040464,0.737046,0.757746,0.774572,0.000870,0.000356,0.005403,0.001025,0.002285,0.000328,914.6,ok,findings/r093.md,human,discarded,recipe-20260913-2,H116,m5_ca1,,,False
r094,2026-09-14T00:06:04+00:00,3afe493-dirty,recipe3_direct_l2,e14cc7bb6ea0,8,14,0.811715,0.785829,0.005354,0.760942,0.785479,0.798871,0.001076,0.001974,0.000873,0.001755,0.004360,0.001318,379.4,ok,findings/r094.md,human,discarded,recipe-20260913-3,H121,m5_ca1,,,False
r095,2026-09-14T00:14:23+00:00,3afe493-dirty,recipe4_rolling_l2,9afe4ed17bac,8,14,0.810924,0.784096,0.005811,0.758482,0.783623,0.797871,0.002115,0.001027,0.003810,0.003465,0.003365,0.002087,495.3,ok,findings/r095.md,human,discarded,recipe-20260913-3,H122,m5_ca1,,,False
r096,2026-09-14T00:23:18+00:00,3afe493-dirty,recipe5_price_l2,fe1f4abb4326,8,14,0.810118,0.782614,0.007603,0.757896,0.782238,0.795827,0.000383,0.002546,0.001647,0.001955,0.006078,0.003056,530.8,ok,findings/r096.md,human,discarded,recipe-20260913-3,H123,m5_ca1,,,False
r097,2026-09-14T00:32:47+00:00,3afe493-dirty,recipe6_calendar_l2,1c83fbc41e45,8,14,0.811325,0.783250,0.012225,0.758133,0.782779,0.796594,0.000328,0.000385,0.001882,0.001955,0.000095,0.000433,564.2,ok,findings/r097.md,human,discarded,recipe-20260913-3,H124,m5_ca1,,,False
r098,2026-09-14T02:08:34+00:00,81cf2c7,recipe6_calendar_l2,,0,14,,,,,,,,,,,,,0.0,error,findings/r098.md,human,discarded,recipe-20260913-3,H124,m5_all,,,False
r099,2026-09-14T03:02:44+00:00,e0033bd,seasonal_naive,895b13f2aeb0,8,14,1.102555,0.930261,-0.017414,0.918916,0.930216,0.937116,0.000000,0.000000,0.000000,0.000000,0.000000,0.000000,135.8,ok,findings/r099.md,human,no_parent,,,m5_3,0.895513,0.000000,False
r100,2026-09-14T03:21:25+00:00,e0033bd-dirty,lgbm_baseline,900159c6f3dd,8,14,0.819671,0.788980,-0.006015,0.780864,0.785261,0.795860,0.000799,0.000477,0.000559,0.001028,0.000299,0.000327,1115.3,ok,findings/r100.md,human,no_parent,,,m5_3,0.671176,0.003027,False
r101,2026-09-14T04:05:05+00:00,e0033bd-dirty,recipe6_calendar_l2,1c83fbc41e45,8,14,0.850768,0.761974,-0.008646,0.738235,0.762981,0.773323,0.001181,0.001502,0.001749,0.003979,0.001975,0.000980,6914.0,ok,findings/r101.md,human,kept,recipe-20260913-3,H124,m5_all,0.698220,0.015857,False
r102,2026-09-14T04:17:12+00:00,e0033bd-dirty,recipe6_calendar_l2,1c83fbc41e45,8,14,0.813534,0.784868,-0.004533,0.756069,0.788368,0.797291,0.001001,0.001769,0.002560,0.003115,0.004076,0.001885,3340.6,ok,findings/r102.md,human,discarded,recipe-20260914-1,H131,m5_3,0.651377,0.011121,False
r103,2026-09-14T05:04:11+00:00,d0478c9,lgbm_baseline,900159c6f3dd,8,14,0.819671,0.788980,-0.006015,0.780864,0.785261,0.795860,0.000799,0.000477,0.000559,0.001028,0.000299,0.000327,480.7,ok,findings/r103.md,human,no_parent,,,m5_3,0.671176,0.003027,False
r104,2026-09-14T05:33:34+00:00,d0478c9-dirty,recipe6_calendar_l2,1c83fbc41e45,8,14,0.813534,0.784868,-0.004533,0.756069,0.788368,0.797291,0.001001,0.001769,0.002560,0.003115,0.004076,0.001885,1760.1,ok,findings/r104.md,human,discarded,recipe-20260914-2,H131,m5_3,0.651377,0.011121,False
r105,2026-09-14T06:36:22+00:00,d0478c9-dirty,recipe_bag3,5cd8cec44895,1,14,,,,,,,,,,,,,3763.8,timeout,findings/r105.md,human,discarded,lever-20260914-1,H141,m5_3,,,False
r106,2026-09-14T08:08:01+00:00,39c2d89,recipe6_calendar_l2,1c83fbc41e45,8,14,0.850768,0.761974,-0.008646,0.738235,0.762981,0.773323,0.001181,0.001502,0.001749,0.003979,0.001975,0.000980,5488.8,ok,findings/r106.md,human,kept,recipe-20260914-2,H124,m5_all,0.698220,0.015857,False
r107,2026-09-14T09:29:18+00:00,39c2d89-dirty,recipe_bag3,5cd8cec44895,8,14,0.812449,0.784284,-0.003689,0.755657,0.787972,0.796524,0.000295,0.000712,0.002436,0.000555,0.001700,0.000514,4867.1,ok,findings/r107.md,human,discarded,lever-20260914-1,H141,m5_3,0.648234,0.002729,False
r108,2026-09-14T09:30:09+00:00,39c2d89-dirty,recipe_bag3,5cd8cec44895,8,14,0.812449,0.784284,-0.003689,0.755657,0.787972,0.796524,0.000295,0.000712,0.002436,0.000555,0.001700,0.000514,0.0,ok,findings/r108.md,human,discarded,lever-20260914-1,,m5_3,0.648234,0.002729,False
r109,2026-09-14T10:21:38+00:00,9b3a973,recipe_scaled,57805361c950,8,14,0.825461,0.798315,0.026894,0.772099,0.804148,0.808490,0.002149,0.001710,0.002137,0.001824,0.004119,0.002007,3136.1,ok,findings/r109.md,human,discarded,lever-20260914-1,H142,m5_3,0.688955,0.012230,False
r110,2026-09-14T11:45:25+00:00,348edc0,recipe_momentum,e9c4f863fa00,8,14,0.811963,0.783518,-0.003400,0.755139,0.788074,0.795219,0.000280,0.000251,0.001579,0.000829,0.000124,0.000639,4924.6,ok,findings/r110.md,human,discarded,lever-20260914-1,H143,m5_3,0.645426,0.001890,False
r111,2026-09-14T14:01:24+00:00,348edc0-dirty,recipe_scaled_w,57805361c950,1,14,,,,,,,,,,,,,8155.0,timeout,findings/r111.md,human,discarded,lever-20260914-1,H144,m5_3,,,False
r112,2026-09-14T16:31:43+00:00,e2caa61,recipe_scaled_w,22acd2b2fc54,8,14,0.824817,0.793086,0.015658,0.758914,0.796479,0.808350,0.000512,0.000444,0.002129,0.000846,0.001855,0.000158,7733.6,ok,findings/r112.md,human,discarded,lever-20260914-1,H144,m5_3,0.655311,0.006976,False
r113,2026-09-14T18:24:00+00:00,6daed60,recipe_calib,103e5da6235e,8,14,0.815586,0.784715,-0.001974,0.753412,0.789615,0.797676,0.000416,0.000279,0.001174,0.000494,0.000635,0.000210,6290.5,ok,findings/r113.md,human,discarded,lever-20260914-1,H145,m5_3,0.672521,0.002764,False
r114,2026-09-14T18:34:06+00:00,41e46a4,lgbm_baseline,b4eec26e00ec,8,14,0.819028,0.788592,-0.006015,0.780484,0.784878,0.795467,0.000799,0.000477,0.000559,0.001028,0.000299,0.000327,549.3,ok,findings/r114.md,human,no_parent,v5-parta-20260914,H150,m5_3,0.670844,0.003027,True
r115,2026-09-14T19:15:16+00:00,581465e,recipe6_calendar_l2,505f0c3a04cd,8,14,0.812108,0.783753,-0.004533,0.755383,0.787353,0.795915,0.001001,0.001769,0.002560,0.003115,0.004076,0.001885,2466.3,ok,findings/r115.md,human,discarded,v5-parta-20260914,H151,m5_3,0.648900,0.011121,True
r116,2026-09-14T19:26:27+00:00,155c385,lgbm_baseline,b4eec26e00ec,8,14,0.819028,0.788592,-0.006015,0.780484,0.784878,0.795467,0.000799,0.000477,0.000559,0.001028,0.000299,0.000327,666.5,ok,findings/r116.md,human,no_parent,v5-parta-20260914,H150,m5_3,0.670844,0.003027,True
r117,2026-09-14T22:32:03+00:00,24eb276,recipe6_calendar_l2_corr,0ac548cdc1fd,8,14,0.832470,0.789320,0.030687,0.767227,0.792041,0.798804,0.000572,0.001824,0.002913,0.003060,0.003345,0.001175,1969.8,ok,findings/r117.md,human,discarded,v5-partb-20260914,H152,m5_3,0.661308,0.013439,True
r118,2026-09-15T00:14:17+00:00,7572404,recipe6_calendar_l2,505f0c3a04cd,8,14,0.849235,0.760999,-0.008646,0.737549,0.762147,0.772140,0.001181,0.001502,0.001749,0.003979,0.001975,0.000980,6121.9,ok,findings/r118.md,human,no_parent,v5-partb-20260914,H153,m5_all,0.695249,0.015857,True
r119,2026-09-15T00:48:08+00:00,855b0b4,recipe6_per_store,97baad3fe5bd,8,14,0.812959,0.785507,-0.007587,0.758546,0.788993,0.797142,0.000369,0.001155,0.003005,0.001459,0.001267,0.002459,1995.9,ok,findings/r119.md,human,discarded,v5-partc-20260914,H155,m5_3,0.637942,0.001070,True
r120,2026-09-15T02:39:33+00:00,5749e4e,recipe6_per_store,97baad3fe5bd,8,14,0.852129,0.764881,-0.019867,0.742197,0.765129,0.776264,0.000810,0.000818,0.002378,0.001230,0.001658,0.000683,6673.5,ok,findings/r120.md,human,discarded,v5-partc-20260914,H156,m5_all,0.702771,0.001934,True
r121,2026-09-16T03:02:16+00:00,a759541,lgbm_baseline,b4eec26e00ec,8,14,0.819028,0.788592,-0.006015,0.780484,0.784878,0.795467,0.000799,0.000477,0.000559,0.001028,0.000299,0.000327,506.0,ok,findings/r121.md,human,discarded,,,m5_3,0.670844,0.003027,True
r122,2026-09-16T13:41:06+00:00,b71f92c,recipe6_l2_slow,f4bcb3f5664c,8,14,0.811719,0.783390,-0.004029,0.755813,0.786850,0.795229,0.000361,0.000307,0.002739,0.003403,0.000485,0.001480,3419.4,ok,findings/r122.md,researcher,discarded,research-20260916-1,H158,m5_3,0.646371,0.005810,True
r123,2026-09-16T15:04:47+00:00,48880d3,recipe6_reconciled,708095906a70,8,14,0.815481,0.783453,-0.014869,0.753268,0.788828,0.795735,0.000828,0.001305,0.003068,0.002161,0.003062,0.001458,2504.6,ok,findings/r123.md,researcher,discarded,research-20260916-1,H159,m5_3,0.657568,0.004184,True
r124,2026-09-16T16:00:27+00:00,4bf8d2e,recipe6_reconciled,082e186d847d,8,14,0.812245,0.783105,0.001445,0.753059,0.787976,0.795577,0.001332,0.001678,0.002671,0.002053,0.003183,0.001750,2259.5,ok,findings/r124.md,researcher,kept,research-20260916-1,H159,m5_3,0.615273,0.003015,True
r125,2026-09-16T17:52:47+00:00,91c6937,recipe6_reconciled,082e186d847d,8,14,0.853991,0.764364,0.007679,0.739175,0.766467,0.776090,0.001205,0.001729,0.002238,0.003410,0.001953,0.001162,6728.9,ok,findings/r125.md,researcher,discarded,research-20260916-1,H159,m5_all,0.723202,0.004137,True
r126,2026-09-17T00:17:52+00:00,f857144,recipe_ens_obj,bd8c04b29993,8,14,0.811360,0.776990,-0.021327,0.749696,0.779146,0.789427,0.000554,0.001226,0.002261,0.002136,0.002478,0.001700,4233.9,ok,findings/r126.md,researcher,discarded,research-20260916-1,H160,m5_3,0.653874,0.004346,True
r127,2026-09-17T20:24:10+00:00,3f15b4c,lgbm_baseline,b4eec26e00ec,8,14,0.859092,0.798396,-0.007187,0.792456,0.793193,0.805451,0.001272,0.000988,0.001544,0.001275,0.001088,0.001057,1771.1,ok,findings/r127.md,human,no_parent,,,m5_screen,0.800956,0.002994,True
r128,2026-09-17T21:06:12+00:00,22c1159,recipe6_calendar_l2,505f0c3a04cd,8,14,0.848074,0.796261,-0.002668,0.770067,0.796968,0.809188,0.000794,0.002437,0.002441,0.002181,0.003507,0.002110,2469.6,ok,findings/r128.md,human,discarded,,,m5_screen,0.733207,0.008584,True
r129,2026-09-17T21:31:43+00:00,875dc37,recipe6_reconciled,082e186d847d,8,14,0.850104,0.796089,0.000380,0.768519,0.797137,0.809641,0.000603,0.001865,0.001396,0.001491,0.002457,0.002443,1526.9,ok,findings/r129.md,human,discarded,,,m5_screen,0.744296,0.005648,True
r130,2026-09-18T02:46:38+00:00,bf20e1b,recipe_ens_rd,d3def937f14b,8,14,0.840062,0.795552,-0.006986,0.774527,0.797361,0.805555,0.000476,0.000689,0.000595,0.000828,0.001492,0.001704,2107.9,ok,findings/r130.md,researcher,kept,research-20260917-1,H163,m5_screen,0.707760,0.000982,True
r131,2026-09-18T04:48:17+00:00,0d6f961,recipe_ens_rd,d3def937f14b,8,14,0.842271,0.760808,-0.011858,0.743071,0.762881,0.769016,0.000468,0.001437,0.000778,0.001640,0.001465,0.001445,7257.1,ok,findings/r131.md,researcher,kept,research-20260917-1,H163,m5_all,0.674480,0.009758,True
r132,2026-09-18T16:54:42+00:00,ece1345,recipe6_calendar_l2_yoy,ad01da32c377,8,14,0.847186,0.793292,-0.008511,0.768373,0.792364,0.806302,0.000358,0.000913,0.002811,0.002590,0.000844,0.000525,2965.8,ok,findings/r132.md,researcher,discarded,research-20260918-1,H164,m5_screen,0.726020,0.005727,True
r133,2026-09-18T18:36:36+00:00,6f8ea97,recipe6_calendar_l2_yoye,3ba62dd6f77b,8,14,0.847509,0.793691,-0.007975,0.769121,0.792475,0.806730,0.001345,0.001182,0.001615,0.000648,0.003175,0.000487,2837.8,ok,findings/r133.md,researcher,discarded,research-20260918-1,H165,m5_screen,0.725256,0.007305,True
r134,2026-09-18T19:32:11+00:00,d6848b9,recipe6_calendar_l2,2538aba6dac8,8,91,0.827530,0.819463,-0.000094,0.778769,0.815098,0.843506,0.000448,0.001821,0.001921,0.001836,0.001455,0.003041,3041.8,ok,findings/r134.md,human,no_parent,,,m5_screen,0.689338,0.005278,True
r135,2026-09-18T20:13:56+00:00,8a24854,recipe6_calendar_l2_hist3y,bd64df90ec5e,8,91,0.821123,0.816418,-0.009174,0.773547,0.813123,0.841045,0.001089,0.001662,0.000492,0.002546,0.001461,0.002836,2500.1,ok,findings/r135.md,researcher,discarded,research-20260918-1,H166,m5_screen,0.682988,0.006554,True
r136,2026-09-18T20:54:40+00:00,c2a6416,recipe6_calendar_l2_yoye_h3y,4359c404abef,8,91,0.820266,0.815280,-0.010491,0.772557,0.810831,0.840441,0.000158,0.000501,0.000511,0.000995,0.001763,0.001971,2439.4,ok,findings/r136.md,researcher,discarded,research-20260918-1,H167,m5_screen,0.681890,0.007158,True
r137,2026-09-18T22:31:07+00:00,2934fe8,recipe_search,92ae0191d850,8,91,0.824723,0.816371,-0.001995,0.776171,0.812817,0.839729,0.000547,0.001109,0.001307,0.002015,0.001116,0.000841,3020.6,ok,findings/r137.md,researcher,kept,loop-20260918-1,H168,m5_screen,0.683412,0.003659,True
r138,2026-09-18T23:34:42+00:00,c960a4e,recipe_search,2f9efe52dbd6,8,91,0.827764,0.819000,0.003588,0.778107,0.815610,0.842619,0.000796,0.000464,0.000698,0.002341,0.001199,0.001089,3810.1,ok,findings/r138.md,researcher,kept,loop-20260918-1,H168,m5_screen,0.680163,0.001445,True
r139,2026-09-19T00:14:37+00:00,2316428,recipe_search,ecc9fa5c33c1,8,91,0.827700,0.820698,-0.000539,0.780837,0.815878,0.844552,0.001236,0.002497,0.001075,0.001257,0.004171,0.002593,2390.8,ok,findings/r139.md,researcher,discarded,loop-20260918-1,H168,m5_screen,0.696552,0.015831,True
r140,2026-09-19T01:21:01+00:00,79e9c4e,recipe_search,f2f62a5a69f1,8,91,0.824357,0.815801,0.002176,0.775546,0.812626,0.838968,0.000826,0.000660,0.001708,0.000758,0.002370,0.000256,3979.4,ok,findings/r140.md,researcher,discarded,loop-20260918-1,H168,m5_screen,0.674065,0.003846,True
r141,2026-09-19T05:50:02+00:00,eb4ba3b,recipe_search,87da5194592a,8,91,0.827334,0.818975,0.005776,0.778173,0.815319,0.842688,0.001012,0.001042,0.001296,0.001985,0.000852,0.001664,4535.4,ok,findings/r141.md,researcher,kept,loop-20260918-1,H169,m5_screen,0.674945,0.006089,True
r142,2026-09-19T07:17:53+00:00,fe9ea17,recipe_search,967bc2e196ab,8,91,0.827228,0.818718,0.007237,0.778568,0.814097,0.842610,0.001642,0.001365,0.000292,0.002033,0.001933,0.001119,5266.0,ok,findings/r142.md,researcher,kept,loop-20260918-1,H169,m5_screen,0.671739,0.002452,True
r143,2026-09-19T08:33:51+00:00,4495054,recipe_search,e442dd1b27b1,8,91,0.824401,0.816353,0.004067,0.776928,0.812230,0.839616,0.001055,0.000439,0.001219,0.002390,0.000824,0.000741,4553.4,ok,findings/r143.md,researcher,kept,loop-20260918-1,H169,m5_screen,0.670919,0.002843,True
r144,2026-09-19T10:46:26+00:00,fb95b0c,recipe_search,3a81662bf882,8,91,0.824118,0.815645,0.004783,0.775372,0.812425,0.838846,0.001229,0.001336,0.001756,0.001340,0.001744,0.001340,7950.3,ok,findings/r144.md,researcher,kept,loop-20260918-1,H169,m5_screen,0.668344,0.005065,True
r145,2026-09-19T14:11:40+00:00,69fad0b,recipe6_calendar_l2,2538aba6dac8,8,91,0.830148,0.785744,-0.006052,0.765149,0.773118,0.804164,0.000492,0.000962,0.001981,0.004285,0.001061,0.000762,12040.7,ok,findings/r145.md,human,no_parent,,,m5_all,0.666559,0.008536,True
r146,2026-09-19T16:27:02+00:00,2fd50ed,recipe_search,2f9efe52dbd6,8,91,0.829997,0.785366,-0.003295,0.765019,0.772342,0.803888,0.000453,0.000849,0.001285,0.002234,0.000119,0.000636,8109.6,ok,findings/r146.md,researcher,kept,loop-20260918-1,H169,m5_all,0.658873,0.007771,True
r147,2026-09-19T19:07:47+00:00,758863f,recipe_search,967bc2e196ab,8,91,0.830023,0.784773,-0.001560,0.765443,0.771636,0.802870,0.001042,0.000727,0.001809,0.004188,0.000500,0.001195,9633.7,ok,findings/r147.md,researcher,kept,loop-20260918-1,H169,m5_all,0.652342,0.004353,True
r148,2026-09-19T19:41:09+00:00,67721c7,recipe6_calendar_l2,2538aba6dac8,8,91,0.827530,0.819463,-0.000094,0.778769,0.815098,0.843506,0.000448,0.001821,0.001921,0.001836,0.001455,0.003041,1539.3,ok,findings/r148.md,human,no_parent,,,m5_screen,0.689338,0.005278,True
r149,2026-09-19T20:20:34+00:00,0c40d18,lgbm_direct_mh7,e9d09bcb55ca,8,91,0.827600,0.822498,0.002650,0.777692,0.815422,0.850100,0.000887,0.001498,0.002297,0.001973,0.001469,0.002000,1528.6,ok,findings/r149.md,researcher,discarded,partd-A-20260919,H170,m5_screen,0.695269,0.003975,True
r150,2026-09-19T20:57:12+00:00,60beca9,lgbm_direct_mh28,6b31a6d0de03,8,91,0.832010,0.827264,0.000181,0.782990,0.815785,0.856877,0.000409,0.000623,0.000762,0.001669,0.000579,0.000289,2193.4,ok,findings/r150.md,researcher,discarded,partd-A-20260919,H170,m5_screen,0.703752,0.004681,True
r151,2026-09-20T01:08:17+00:00,1be54ec,r147,,8,91,,,,,,,,,,,,,0.0,ok,adversary/reviews/exp/r147.md,adversary,,adversary-20260919-1,H169,m5_all,0.653410,,False
r152,2026-09-20T05:06:38+00:00,c25d76e,recipe6_reconciled_shrink,91db6840cb3c,8,91,0.827524,0.819739,0.004103,0.778353,0.813635,0.845088,0.000321,0.001839,0.002590,0.002244,0.001471,0.002907,1580.0,ok,findings/r152.md,researcher,discarded,partB-20260919,H171,m5_screen,0.686671,0.002890,True
r153,2026-09-20T07:30:57+00:00,81d55f1,recipe_ens_stack,e2ff6c7dbba6,8,91,0.829299,0.810580,-0.019073,0.771599,0.805023,0.834390,0.001384,0.000897,0.001448,0.000640,0.002000,0.001363,8640.1,ok,findings/r153.md,researcher,discarded,partC-20260919,H172,m5_screen,0.720365,0.018356,True
r154,2026-09-20T15:11:29+00:00,fa56f17,recipe6_calendar_l2,2538aba6dac8,4,91,0.793158,0.806973,0.014427,0.763034,0.820300,0.822899,0.001617,0.000533,0.001498,0.002464,0.005094,0.005005,853.0,ok,findings/r154.md,human,no_parent,,,m5_screen,0.650463,0.005950,True
r155,2026-09-20T15:34:21+00:00,647b4e9,recipe6_calendar_l2_cap511,ed10afa1f304,4,91,0.792221,0.805801,0.019074,0.764748,0.821235,0.819176,0.001677,0.003671,0.003662,0.000494,0.003596,0.005826,1367.1,ok,findings/r155.md,researcher,discarded,partA-mirror-20260920,H169,m5_screen,0.644318,0.009338,True
r156,2026-09-20T15:41:10+00:00,892de72,fm_chronos_bolt,72e9a9109c16,4,91,0.823981,0.724316,-0.348055,0.692944,0.721428,0.741859,0.000000,0.000000,0.000000,0.000000,0.000000,0.000000,53.5,ok,findings/r156.md,researcher,no_parent,partB-20260920,H173,m5_screen,1.682457,0.000000,False
r157,2026-09-21T04:23:50+00:00,04d8311,recipe6_calendar_l2_l3,90c9931327c8,4,91,0.792454,0.804732,0.014733,0.762311,0.819146,0.819312,0.000977,0.001383,0.001348,0.002361,0.001058,0.003873,873.8,ok,findings/r157.md,researcher,discarded,partC-20260920,H174,m5_screen,0.648678,0.004366,True
r158,2026-09-21T04:53:21+00:00,c615ef8,recipe6_calendar_l2_l3,90c9931327c8,8,91,0.827599,0.819344,0.001226,0.777688,0.815457,0.843621,0.000107,0.000740,0.001297,0.001245,0.001874,0.000761,1660.9,ok,findings/r158.md,researcher,discarded,partC-20260920,H174,m5_screen,0.687337,0.002918,True
r159,2026-09-21T17:24:54+00:00,446b855,recipe6_calendar_l2_l3g,,0,91,,,,,,,,,,,,,0.0,error,findings/r159.md,researcher,discarded,partC-20260920,H175,m5_screen,,,True
r160,2026-09-21T17:44:16+00:00,ee01cd3,recipe6_calendar_l2_l3g,5a4203854305,4,91,0.792549,0.804805,0.014550,0.762769,0.819245,0.819156,0.001289,0.001128,0.001993,0.002535,0.000805,0.003397,1076.0,ok,findings/r160.md,researcher,discarded,partC-20260920,H175,m5_screen,0.644908,0.006797,True
r161,2026-09-21T18:12:36+00:00,1b29c61,recipe6_calendar_l2_l3g_cap511,23a32a17e390,4,91,0.791553,0.804705,0.019553,0.763730,0.819216,0.818500,0.000642,0.000213,0.002575,0.002710,0.001844,0.002223,1606.2,ok,findings/r161.md,researcher,kept,partC-20260920,H176,m5_screen,0.638041,0.003500,True
r162,2026-09-21T19:46:55+00:00,e13c0df,recipe6_calendar_l2_cap511,ed10afa1f304,4,91,0.805272,0.768888,0.019543,0.722174,0.777793,0.788595,0.001399,0.002142,0.001207,0.003226,0.001124,0.003603,5578.9,ok,findings/r162.md,human,no_parent,,,m5_all,0.620938,0.005398,True
r163,2026-09-21T21:12:20+00:00,c9cf766,recipe6_calendar_l2_l3g_cap511,23a32a17e390,4,91,0.805454,0.768416,0.019236,0.721036,0.776667,0.788782,0.001746,0.000834,0.000812,0.001228,0.003499,0.001136,5111.7,ok,findings/r163.md,researcher,kept,partC-20260920,H176,m5_all,0.617143,0.008312,True
r164,2026-09-21T22:48:54+00:00,de06277,r163,,4,,,,,,,,,,,,,,0.0,ok,adversary/reviews/exp/r163.md,adversary,,adversary-20260921-1,H176,m5_all,,,False
r165,2026-09-22T04:52:45+00:00,e2e122e,recipe6_calendar_l2_l3ge_cap511,15c17bc14d68,4,91,0.792060,0.805017,0.018300,0.763079,0.819464,0.819346,0.000466,0.002199,0.001610,0.001750,0.003734,0.001987,1500.4,ok,findings/r165.md,researcher,kept,partC-20260921,H177,m5_screen,0.641030,0.002387,True
