cycle,run_id,label,agg_hier,agg_gain,spring_gain,keep_verdict,spring_gate,config
1,r137,easter_anchor,0.683412,+0.005926,+0.004078,kept,PASS,"{""label"": ""easter_anchor"", ""yoy_easter_window"": 21}"
2,r138,leaves255,0.680163,+0.009175,+0.017375,kept,PASS,"{""label"": ""leaves255"", ""params"": {""num_leaves"": 255}}"
3,r139,min_child_50,0.696552,-0.007214,-0.010083,discarded,FAIL,"{""label"": ""min_child_50"", ""params"": {""min_child_samples"": 50}}"
4,r140,easter+leaves255,0.674065,+0.015273,+0.025209,discarded,PASS,"{""label"": ""easter+leaves255"", ""yoy_easter_window"": 21, ""params"": {""num_leaves"": 255}}"
1,r141,leaves383,0.674945,+0.014392,+0.022006,kept,PASS,"{""label"": ""leaves383"", ""params"": {""num_leaves"": 383}}"
2,r142,leaves511,0.671739,+0.017599,+0.032104,kept,PASS,"{""label"": ""leaves511"", ""params"": {""num_leaves"": 511}}"
3,r143,easter+leaves383,0.670919,+0.018419,+0.026823,kept,PASS,"{""label"": ""easter+leaves383"", ""yoy_easter_window"": 21, ""params"": {""num_leaves"": 383}}"
4,r144,easter+leaves511,0.668344,+0.020993,+0.030588,kept,PASS,"{""label"": ""easter+leaves511"", ""yoy_easter_window"": 21, ""params"": {""num_leaves"": 511}}"
